Presotea,45.5068891,-73.56843830000001,ChIJaa4ARiUbyUwRP8OpkOBeAMU,60,"['McGill University', 'Cegep of Old Montreal', 'University of Quebec at Montreal', 'University of Quebec in Montreal', 'ISI, Higher Institute of Computer Science', 'Desautels Faculty of Management, McGill University', 'NAD - École des arts numériques, de l’animation et du design', 'McGill Executive Institute', 'Centre de réadaptation en dépendance de Montréal – Institut universitaire', ""Institut de Recherches et d'Études Féministes (IREF)"", 'Laval University - Montreal Office', 'McGill School of Continuing Studies', 'English and French Language Programs', 'Department of East Asian Studies', 'Department of Atmospheric and Oceanic Sciences', 'School Show-Business', 'McGill University', 'McGill University Service Point', 'Trottier Space Institute', 'McGill University Safety', ""École de design de l'UQAM"", 'Ordre Des Geologues', 'Canada College', 'Memorial Pool', 'Elite Consultation & Formation Association', 'Collège Salette', 'Judith Jasmin Pavilion Annex', 'Education Canada College', 'Trebas Institute', 'Laboratoire de résistance sémiotique', 'EMBA McGill - HEC Montreal', 'Newman Centre of McGill University', 'The Presbyterian College, Montreal', 'Volumes College', 'UQAM - Pavillon President-Kennedy', 'Cybersecurity degree and certification (by Kensley College)', 'Kensley College', 'Collège Greystone à Montréal', ""Majlis ta'lim Nurul mangsub"", 'UQAT Center in Montreal', 'Collège Tmi', 'Languages, Literatures, and Cultures - Hispanic Studies', 'Mcit', 'Complexe des sciences Pierre-Dansereau', 'CGH College', 'Maass Chemistry Building', 'Ferrier Building 2', 'college', 'mcgill', 'HEC Montréal - Édifice Hélène-Desmarais', 'École des dirigeants HEC Montréal', 'Macdonald-Harrington Building', 'Maison Arthur-Kivell-Fisk', 'Voyages En Direct University', 'McConnell Engineering Building', 'Macdonald Engineering Building', 'React Academy', 'Arts OASIS', 'Mcgill College', 'UQAM pavillon V']",774.4333333333333,67.0,60,"['University of Quebec at Montreal', 'F.A.C.E. Elementary and Secondary School', 'MLS', 'Berlitz Montréal Learning Centre', 'Adult Education and Vocational Training Network', 'Gemmological Institute of Montreal', 'UQAM', 'Coeur des sciences', 'Hexagram-UQAM', 'McGill School of Continuing Studies', 'Blitz Tutorat', 'School Show-Business', 'FARMM', ""Conseil des Fonds d'Investissement du Québec"", 'McGill University Office of Sustainablity', 'Fashion College ESG UQÀM, in Partnership with the UQÀM Faculty of Arts', 'Zumba Montreal', 'McGill CPE', 'Elite Québec', 'Kaplan (Canada) Ltd', 'Canadian Institute For Health', 'Collège MEGA', 'MLS Inc', 'Trebas Institute', 'Superior College Of Montreal, Inc.', 'Paulo Bottas - Music', 'Academie Bar Pro', ""Académie Herb'holiste Inc. Course D'herboristerie"", 'Zoom Académie', 'Montreal School of Jewelery', 'Matthew Lui Kung Fu', 'Jam Vocal Academy', 'Galerie Bejo', 'Ecole de management INSA School of Management', 'Regroupement pour la formation en audiovisuel du Québec', 'Club Immobiliet', 'School Circus', 'Flag Sherbrooke', 'SC COLLEGE QUEBEC', '蒙特利尔中加语言文化学院', 'Office for Sexual Violence Response, Support and Education', 'UQAM Pavillon Sherbrooke', 'Collège Greystone à Montréal', 'Kpodjehoun Sodji Baba', 'Medan utara', 'Caron Ltee Language School', 'UQAT Center in Montreal', 'Academic Values', 'Elizabeth Wirth Music Building', 'Stem Montessori Academy of Canada Montreal', 'Schulich School of Music', 'Institute Leadership In Gestion', 'Cpe', 'Department of Languages, Literatures, and Cultures - Russian and Slavic Studies', 'Stationnement Face', 'McGill University - Undergraduate Teaching Clinic', 'Kambhampati Research Group', 'École Alemán', 'College La Perle', 'École de bar MADE WITH LOVE Bar School']",590.3666666666667,161
Bubble Tea Shop,45.4353377,-73.6272065,ChIJbxOMo0wRyUwRnZRUrJQC8co,3,"['Cester College Lasalle Campus', 'Cestar College Quebec - Campus LaSalle', 'M College of Canada']",636.0,636.0,15,"['École Montessori de Montréal', 'Julia Tutoring', 'Wonderland Preschool', 'LaSalle Elementary School - Junior Campus', 'Ninon Prevost', 'Lasalle Elementary School - Senior Campus', ""Children's World Academy"", 'Terre-des-Jeunes Elementary School', 'Blue Penguin', 'Saint Lawrence Academy', 'Centre Préscolaire Montessori', 'Laurendeau-Dunton Elementary School', 'UCMAS Abacus and Mental Math Program', 'Garderie', 'Ma Saraswati Music Classes']",859.3333333333334,448
Tiger Sugar Montréal,45.4961893,-73.5774184,ChIJoeNGAjwbyUwRcPoZHmiKVrU,60,"['Collège of Montréal', 'Collège LaSalle', ""O'Sullivan College"", 'McGill University', 'Concordia University', 'Desautels Faculty of Management, McGill University', 'Académie Michèle-Provost', 'Middle School Inter-Dec', 'McGill Executive Institute', 'JIS education 菁华学院', 'McGill University Safety', 'Immersive and Creative Technologies Lab, Concordia University', 'Concordia Bootcamps', 'Herzing College Montreal', 'Ordre Des Geologues', 'Canada College', 'Lasalle Service', 'McGill', 'Middle School De Montréal', 'McGill University Service Point', 'Elite Consultation & Formation Association', 'Newman Centre of McGill University', 'Department of Atmospheric and Oceanic Sciences', 'English and French Language Programs', 'Department of East Asian Studies', 'Education Canada College', 'Stewart Biology Building - McGill University 🎓🏫', 'John Molson School of Business', 'McGill School of Continuing Studies', 'IISE Concordia Chapter', 'LB Building, Concordia University', 'Concordia Card Services - Student ID', 'Pavillon Ev Building', '4TH SPACE, Concordia University', 'matralab', 'Sir George Williams Campus', 'JMSB', 'FiQbe', 'H Building Concordia University', 'Faubourg Tower', 'Conservative Concordia', 'MCMT College of Science', 'Concordia University Department of Computer Science and Software Engineering', 'Centre arts et santé de Concordia', 'Concordia University ER Building', 'CENPARMI - Concordia University', 'Concordia Model United Nations Conference', ""Concordia University's Centre for Creative Reuse"", 'GCES', 'Concordia University VA Building', 'Canada college new campus', 'Université McGill', 'COLLÈGE CANADA', ""Canada College - King's Campus"", 'Grey Nuns Building, classroom entrance', 'TAC College Solutions Inc', 'Veritas College of Technology Inc.', 'Hosmer House Annex', 'UNIVERSITE DE MONTREAL', 'S et G']",577.05,113.0,60,"['Collège of Montréal', 'Académie Michèle-Provost', 'EC Montreal English Language School', 'LAB Montreal - Languages Across Borders', 'MLS', 'Middle School Inter-Dec', 'Summit T E C C', 'General Physics Corporation', 'Fleur de Lys (Linguistic Services)', '四海同游', '法语认证班 - 双维国际菁英教育', 'ISART Digital Montréal Inc', 'Medhat Hanbali - Film Composer', 'School of Community and Public Affairs, Concordia University', 'Academie', 'Grade Gurus', ""Let's Go First Aid"", 'Herzing College Montreal', ""Conseil des Fonds d'Investissement du Québec"", 'Collège MEGA', 'Zumba Montreal', 'Canadian Institute For Health', 'McGill University Office of Sustainablity', 'McGill CPE', 'CPE Genesis', 'Alima, Centre de nutrition sociale périnatale (anciennement Dispensaire diététique de Montréal)', 'McGill University - Faculty of Law', 'Blitz Tutorat', 'National Truck Driving School Downtown MTL. Guy. C', 'Garderie Rainbow Daycare', 'Centennial College', 'Academie Internationale De', 'Trafalgar School for Girls', 'Japanese Language School In Montreal', 'The Sacred Heart School of Montreal', 'Fraser Institute', 'McGill School of Continuing Studies', 'Beyond Education Canada', 'Studio Vandendool (Guitar lessons)', 'Concordia Print Shop', 'J.W. McConnell Pavillion', 'Fac Mtl', 'FB building', 'GM building', 'Concordia University, Guy - De Maisonneuve Building', 'Concordia Ffar', 'Al Madinah Mosque', 'Parking Moto', 'Q Annex Building', 'Hall Building Auditorium', 'T Annex Building', 'Concordia University, John Molson Building', 'Mel Hoppenheim School of Cinema', 'Concordia University Learning Square (LS)', 'RR Annex', 'MB Concordia University - School of Business', 'School FB Building', 'Concordia Continuing Education', 'FA Annex', 'Concordia Tour']",514.3833333333333,78
Bubble Tea Shop,45.507711,-73.563628,ChIJybSb0IobyUwRdzj16GXLx2E,58,"['Cegep of Old Montreal', 'University of Quebec in Montreal', 'University of Quebec at Montreal', 'ISI, Higher Institute of Computer Science', 'NAD - École des arts numériques, de l’animation et du design', ""Institut de Recherches et d'Études Féministes (IREF)"", 'School Show-Business', ""École de design de l'UQAM"", 'Laboratoire de résistance sémiotique', 'Laval University - Montreal Office', 'Judith Jasmin Pavilion Annex', 'McGill School of Continuing Studies', 'English and French Language Programs', 'Department of East Asian Studies', 'Centre de réadaptation en dépendance de Montréal – Institut universitaire', 'McGill University', 'Department of Atmospheric and Oceanic Sciences', 'Trebas Institute', 'Collège Salette', 'Collège CDI - Montréal', 'EMBA McGill - HEC Montreal', 'Education Canada College', 'CGH College', 'mcgill', 'React Academy', 'UQAM - Pavillon President-Kennedy', 'Volumes College', 'UQAM pavillon V', 'HEC Montréal - Édifice Hélène-Desmarais', 'École des dirigeants HEC Montréal', 'Complexe des sciences Pierre-Dansereau', 'Registrariat - UQAM', 'Cybersecurity degree and certification (by Kensley College)', 'Kensley College', 'Mcit', 'UQAM', ""Service des Archives et de Gestion des Documents de l'Uqam"", ""Majlis ta'lim Nurul mangsub"", 'Startup Playground', 'Ferrier Building 2', 'college', 'Collège Greystone à Montréal', 'CHOQ.ca', 'UQAT Center in Montreal', 'Voyages En Direct University', 'AFELC-UQAM', 'Transept sud– Anciennement Cathédrale Saint-Jacques de Montréal – Maintenant UQAM', 'Collège Tmi', 'Languages, Literatures, and Cultures - Hispanic Studies', 'Foundation Uqam', 'CEGEP', 'ESMA, 3D College in Montreal', 'Maass Chemistry Building', 'Pinacoteca', 'The Presbyterian College, Montreal', 'Macdonald-Harrington Building', 'College Supérieur Montréal', 'Roy Pain Lab']",948.8965517241379,220.0,60,"['University of Quebec at Montreal', 'F.A.C.E. Elementary and Secondary School', 'Berlitz Montréal Learning Centre', 'School Show-Business', 'Gemmological Institute of Montreal', 'Coeur des sciences', 'Hexagram-UQAM', 'UQAM', 'Adult Education and Vocational Training Network', 'Fashion College ESG UQÀM, in Partnership with the UQÀM Faculty of Arts', 'Elite Québec', 'Observatory Compétences-Emplois', 'Blitz Tutorat', 'MLS', 'McGill School of Continuing Studies', 'EFPHQ Vocational Training School In Hypnotherapy', 'Axion 21 Centre Linguistique', 'Paulo Bottas - Music', 'Kaplan (Canada) Ltd', 'MLS Inc', 'Superior College Of Montreal, Inc.', ""School Preparatory Music De L'uqam"", 'Trebas Institute', 'FARMM', ""Institut national de l'image et du son"", 'Academie Bar Pro', 'Place Aux Jeunes Du Quebec', 'CGH College', 'Isi - Cegep', 'Jam Vocal Academy', 'Galerie Bejo', 'Matthew Lui Kung Fu', 'École de bar MADE WITH LOVE Bar School', '학회장', 'Kendrick garderie', 'Ecole de management INSA School of Management', 'Immigration Canada', 'École Alemán', 'School Circus', 'School of architecture, McGill University', 'Montreal School of Jewelery', ""Centre d'évaluation de compétences linguistiques (CECL-UQAM)"", 'L’Academie internationale de la conférence', 'hi', 'Regroupement pour la formation en audiovisuel du Québec', 'UQAM Pavillon Sherbrooke', 'Zoom Académie', 'School Alexandra', 'Flag Sherbrooke', 'School', 'Cpe', 'Espi Campus Montréal', 'Club Immobiliet', 'Maison blanche', '语言学校', 'Escuela Canada', 'College La Perle', 'Training Center Éducagir', 'Camp By Day Photo-Entrequatreyeux', 'SC COLLEGE QUEBEC']",801.7666666666667,220
Bubble Tea Shop,45.47322,-73.600918,ChIJGdlgCcoRyUwRnJdnwvw2hqU,1,['Stone Hon. Paul Gerin - Lajiue'],1200.0,1200.0,44,"['Centre des arts visuels / The Visual Arts Centre', 'Westmount Park Elementary School', 'CPA Gadbois', ""Ieoq - Institut D'enseignement De L'ostéopathie Du Québec"", 'Centre Saint-Paul', 'Saint-Zotique Elementary School', 'N C J Educational Services', 'Preschool Blossom Academy', 'James Lyng Adult Education Centre', 'Church Prayer Palace', 'Ropasom', 'Montreal Oral School for the Deaf, Inc.', 'Garderie Montessori Westmount', 'École de DJ la Roue de Camelot', ""Nursery Mina's small treasures Inc."", 'Darriet F', 'Harmonie Musicothérapie', 'Ics Canada High School', 'roslyn mountainside', 'MaFa Studio', 'Express Voice Studio NDG', 'Singing Lessons with Tamar and Geoff', 'The Westmount Piano Studio', '成人英文学校', 'Enfance Pour Tous Upper Lachine', 'Outreach High School', 'Saint-Léon-de-Westmount School - Charlevoix Extension', 'Mini-Med School', '가나다 한국어 학교', 'FCCCQ', '教育局', 'GANADA Korean Language School', 'Institute Somatraining', 'Garderie Éducative Autour Du Monde', '桐桐学校', 'Centennial Academy', 'Primary School Saint-Raymond', 'Jonathan Stein', 'MacKay School for the Deaf', 'Studio 222', '忻忻学校', 'Chapman Piano Studio NDG/Westmount - Cours de Piano et Guitare', ""School Saint-Luc - Annexe Prud'homme"", 'Les Petits Trésors']",1166.840909090909,589
Real Fruit Bubble Tea,45.5281968,-73.6481237,ChIJjZnSgWcZyUwRadG4smP-FvA,0,[],,,13,"['OnlinePastryTrainingSchool.com', 'Centre Musical Métropolitain', 'The Ali Ibn Abi Talib School', 'Sinclair Laird Elementary School', 'Educ-Action', 'St. Raphael School', 'Nursery', 'Dao Pham Piano', 'Canadian Barista Institute - Montreal Lab', 'Garderie Daycare', 'Langdon Daycare Center', 'Tricots Symar', 'Barclay Primary School']",1270.6923076923076,849
OCHA,45.4944114,-73.5788549,ChIJr1LHuxkbyUwRujQmeAk5C2g,57,"['Collège of Montréal', 'Collège LaSalle', ""O'Sullivan College"", 'Concordia University', 'Dawson College', 'Desautels Faculty of Management, McGill University', 'Académie Michèle-Provost', 'Middle School Inter-Dec', 'JIS education 菁华学院', 'Concordia Bootcamps', 'Immersive and Creative Technologies Lab, Concordia University', 'Herzing College Montreal', 'Lasalle Service', 'Middle School De Montréal', 'McGill Executive Institute', 'Canada College', 'Ordre Des Geologues', 'McGill', 'John Molson School of Business', 'Newman Centre of McGill University', 'IISE Concordia Chapter', 'Faubourg Tower', 'JMSB', 'FiQbe', ""Concordia University's Centre for Creative Reuse"", 'Pavillon Ev Building', 'Concordia University ER Building', 'CENPARMI - Concordia University', 'Centre arts et santé de Concordia', 'Grey Nuns Building, classroom entrance', 'Concordia University Department of Computer Science and Software Engineering', 'matralab', '4TH SPACE, Concordia University', 'LB Building, Concordia University', 'Concordia Card Services - Student ID', 'Sir George Williams Campus', 'Concordia Model United Nations Conference', 'H Building Concordia University', 'Conservative Concordia', 'GCES', 'MCMT College of Science', 'Veritas College of Technology Inc.', 'Concordia University VA Building', 'UNIVERSITE DE MONTREAL', 'Université McGill', 'Canada college new campus', 'COLLÈGE CANADA', ""Canada College - King's Campus"", 'S et G', 'TAC College Solutions Inc', 'Stewart Biology Building - McGill University 🎓🏫', 'Hosmer House Annex', 'Divison of Child Psychiatry, McGill University', 'CEGEP', 'Education Canada College', 'Broadway Academy', 'McGill Art Hive']",568.2456140350877,70.0,60,"['Collège of Montréal', 'Académie Michèle-Provost', 'EC Montreal English Language School', 'LAB Montreal - Languages Across Borders', 'Middle School Inter-Dec', 'Summit T E C C', 'Fleur de Lys (Linguistic Services)', ""Let's Go First Aid"", '法语认证班 - 双维国际菁英教育', '四海同游', 'ISART Digital Montréal Inc', 'School of Community and Public Affairs, Concordia University', 'Herzing College Montreal', 'Medhat Hanbali - Film Composer', 'Academie', 'Grade Gurus', 'Alima, Centre de nutrition sociale périnatale (anciennement Dispensaire diététique de Montréal)', 'CPE Genesis', 'Collège MEGA', 'Zumba Montreal', 'Canadian Institute For Health', 'Garderie Rainbow Daycare', 'General Physics Corporation', ""Conseil des Fonds d'Investissement du Québec"", 'McGill University Office of Sustainablity', 'National Truck Driving School Downtown MTL. Guy. C', 'McGill CPE', 'Centennial College', 'The Sacred Heart School of Montreal', 'Academie Internationale De', 'Trafalgar School for Girls', 'Japanese Language School In Montreal', 'McGill University - Faculty of Law', 'Studio Vandendool (Guitar lessons)', 'Beyond Education Canada', 'Fraser Institute', 'Escuela de Inglés en Montreal', 'Concordia University, Toronto - Dominion Building', 'Concordia University FG building', 'Qin Academy', 'Concordia Continuing Education', ""Jiacheng International Centre D'échange Culture"", 'Department of Education', 'School FB Building', 'MB Concordia University - School of Business', 'Mel Hoppenheim School of Cinema', 'Concordia University, John Molson Building', 'FB building', 'Centre International de Langue Sishu', 'FENGYE College Center', 'Concordia University, Guy - De Maisonneuve Building', 'Victoria School', 'GM building', 'Monbec', 'Express Voice Studio. Cours de Chant Downtown', 'Grey Nuns Building', 'Conference Services', 'Al Madinah Mosque', 'Concordia University Learning Square (LS)', 'Simone de Beauvoir Institute']",465.1666666666667,3
Bubble Tea Shop,45.5017799,-73.56017,ChIJG1Njs2sbyUwRlglb_KzPvyo,29,"['École de technologie supérieure ÉTS', 'ISI, Higher Institute of Computer Science', 'NAD - École des arts numériques, de l’animation et du design', 'Elite Consultation & Formation Association', 'School Show-Business', 'Maison des étudiants - Pavillon E , ETS', 'Education Canada College', 'EMBA McGill - HEC Montreal', 'Startup Playground', 'HEC Montréal - Édifice Hélène-Desmarais', 'École des dirigeants HEC Montréal', 'Voyages En Direct University', 'Ferrier Building 2', 'college', 'SKYWAYS AVIATION', 'Geodar', 'CGH College', 'Mcit', 'ÉTS Residence Hall Phase 1 and 2', ""Carrefour d'innovation INGO (ETS)"", 'Cemiar Technologie', 'ETS, Pavillon A', 'School of Technology Superior - ETS Building B', ""Majlis ta'lim Nurul mangsub"", 'ÉTS Formation', 'Volumes College', 'mcgill', 'React Academy', 'Sahar']",843.2413793103449,179.0,60,"['Imagination Preschool & Nursery', 'EFPHQ Vocational Training School In Hypnotherapy', 'Adult Education and Vocational Training Network', 'School Show-Business', 'Axion 21 Centre Linguistique', 'Elite Québec', 'Gemmological Institute of Montreal', 'Blitz Tutorat', 'UQAM', 'Superior Technical University - ETS, Pavillon B', 'General Physics Corporation', 'Bonne Aventure Preschool Daycare', 'Canadian Institute For Health', 'MLS Inc', 'Superior College Of Montreal, Inc.', 'Zumba Montreal', 'Ubisoft Campus', 'Academie Bar Pro', 'Place Aux Jeunes Du Quebec', 'Ela Jambo', 'Training Au Square', 'School of architecture, McGill University', 'Artilena, Music School', 'Lo & Co', 'Fusion Youth', 'Dokoma', 'Vision Nova Lingua', 'Camp By Day Photo-Entrequatreyeux', 'hi', 'Maison blanche', 'ilsc', 'School Dd Technology Superieure', 'L’Academie internationale de la conférence', 'Old Boucheron Language School (1988)', 'School', '학회장', 'Isi - Cegep', 'Training Center Éducagir', 'Espi Campus Montréal', 'Réseau Archéo-Québec', '语言学校', 'Escuela Canada', 'Sosprof', 'Zoom Académie', 'concordia', 'Stanilas', 'School Laughter De Montréal', 'Carnation', 'Cégep du vieux Montréal', 'Louis Belley', 'Ecole Tecnick', 'The testing location', 'Coronation primary', 'Kitem', 'College La Perle', 'OTA Inc.', 'Middle School', 'Daku', 'San Pedro', 'Manjhiyawan bhonatoli']",634.65,177
Presotea Lasalle,45.44045240000001,-73.6222118,ChIJ-5uMFkgRyUwRQjoJSVO987o,0,[],,,11,"['École Montessori de Montréal', 'Wonderland Preschool', 'LaSalle Elementary School - Junior Campus', ""Children's World Academy"", 'Terre-des-Jeunes Elementary School', 'UCMAS Abacus and Mental Math Program', 'Blue Penguin', 'Workshops Municipaux André-Traversy', 'Orée-du-Parc Primary School', 'Saint Lawrence Academy', 'Centre Préscolaire Montessori']",1101.1818181818182,205
Kung Fu Tea Montreal (Vieux-Montréal),45.5053411,-73.5565033,ChIJWc4eP90byUwREgXjg-EOJiM,21,"['University of Quebec in Montreal', 'ISI, Higher Institute of Computer Science', 'School Show-Business', 'NAD - École des arts numériques, de l’animation et du design', ""Institut de Recherches et d'Études Féministes (IREF)"", ""École de design de l'UQAM"", 'EMBA McGill - HEC Montreal', 'Startup Playground', 'CGH College', 'Pinacoteca', 'React Academy', 'HEC Montréal - Édifice Hélène-Desmarais', 'École des dirigeants HEC Montréal', 'mcgill', 'UQAM pavillon V', 'Registrariat - UQAM', 'Voyages En Direct University', 'Ferrier Building 2', 'college', 'CHOQ.ca', 'Volumes College']",1018.047619047619,394.0,60,"['Imagination Preschool & Nursery', 'EFPHQ Vocational Training School In Hypnotherapy', 'Elite Québec', 'Axion 21 Centre Linguistique', 'School Show-Business', 'Gemmological Institute of Montreal', 'Observatory Compétences-Emplois', 'Fashion College ESG UQÀM, in Partnership with the UQÀM Faculty of Arts', 'Adult Education and Vocational Training Network', 'UQAM', 'MLS Inc', 'Superior College Of Montreal, Inc.', 'Ubisoft Campus', 'Place Aux Jeunes Du Quebec', 'Academie Bar Pro', '语言学校', 'Escuela Canada', 'Espi Campus Montréal', 'Kitem', 'OTA Inc.', 'Bar School', 'Maison blanche', 'L’Academie internationale de la conférence', 'Camp By Day Photo-Entrequatreyeux', '학회장', 'Old Boucheron Language School (1988)', 'soccer', 'Dokoma', 'Réseau Archéo-Québec', 'Vision Nova Lingua', 'ilsc', 'Formation BartendOne', 'Isi - Cegep', 'School of architecture, McGill University', 'Ela Jambo', 'Fusion Youth', 'CGH College', 'School Dd Technology Superieure', 'hi', 'Training Au Square', 'CPE', 'Lo & Co', 'Artilena, Music School', 'School', 'H', 'Immigration Canada', 'Training Center Éducagir', 'Jam Vocal Academy', 'Galerie Bejo', 'Matthew Lui Kung Fu', 'School Alexandra', 'Ecole de management INSA School of Management', ""Centre d'évaluation de compétences linguistiques (CECL-UQAM)"", 'College La Perle', 'Kendrick garderie', 'School Circus', 'concordia', 'Stanilas', 'School Laughter De Montréal', 'Carnation']",756.15,65
Presotea,45.4962109,-73.62237809999999,ChIJ85yPT8gZyUwRP4ILdax0-WE,38,"['College Jean-de-Brebeuf', 'HEC Montreal', 'Faculty of Continuing Education of the University of Montreal', 'Centre for International Peace and Security Studies', 'UdeM - Reception and study management service', 'University of Montreal Bookstore - Jean-Brillant Pavilion', ""Centre de l'engagement étudiant"", 'Editions Themis Universite', 'UdeM – Pavillon Jean-Coutu', 'UdeM – Roger-Gaudry Pavillon', 'International Journal of Arts Management', 'UdeM – Faculté de droit', 'Marie of France International College', 'Clinique universitaire de la vision | Université de Montréal', 'Appartements La Sorbonne (Les)', 'Université de Montréal Office of Communications and Public Relations', ""École d'optométrie | Université de Montréal"", 'Université de Montréal - Office of Research Services and Development', 'Decelles Building', 'UdeM – Lionel-Groulx Pavilion', 'SAFIRE', 'Faculté des arts et des sciences - Département d’anthropologie', 'Faculté des arts et des sciences - École de bibliothéconomie et des sciences de l’information', 'Faculté des arts et des sciences - Département d’informatique et de recherche opérationnelle', 'Club Art Social Brébeuf', 'UdeM – Samuel-Bronfman Pavillon', 'Brébeuf', 'ACPUM', 'University of Montreal', 'University of Montreal - Paul-G-Desmarais Building', 'Bibliothèque de mathématiques et informatique', 'UdeM – André-Aisenstadt Pavillon', ""Centre Interuniversitaire de Recherche sur les Réseaux d'Entreprise, la Logistique et le Transport (CIRRELT)"", 'Pavillon Claire McNicoll', 'Chaire de gestion des arts Carmelle et Rémi-Marcoux HEC Montréal', 'LABORATORY FOR THE STUDY OF CALCIFIED TISSUES AND BIOMATERIALS', 'Chaire UNESCO en paysage urbain', 'University of Montréal - Faculty of Environmental Design']",703.9736842105264,142.0,49,"['College Jean-de-Brebeuf', 'HEC Montreal', 'Notre-Dame College', 'Garderie Métropolitain', 'Simonne-Monet School', 'Aélum', 'International School Marie de France', 'Free Hebrew for Juniors', 'QuébecGuitare.com - Cours de Guitare Privé & Suivi en Ligne', 'Garderie Les Enfants Du Pommier', 'Villa Sainte-Marcelline', 'École de Théologie Évangélique du Québec', 'Notre-Dame-des-Neiges Elementary School', 'Parking', 'Hihi', 'Cpe', 'Barber Joseph', 'Ciqss', 'School Entre Les Lignes', '준휘학교', 'Yaya Garderie', 'Marie-Victorin', 'Manga Montréal', 'Tommaso', 'UdeM – Lionel-Groulx Pavilion', 'BBF', 'ICAJ', '泾大学预科', 'Maîtrise des Petits Chanteurs du Mont-Royal', 'Coop Bécik atelier de vélo', 'Job Chsld', 'Jasmeet', 'Parking Essaie 1', 'Cpe Chateau Des Neiges. Flag Chateau Des Neiges', 'Emica College', 'Aefe School', 'Church Nativité', 'Collège international des Marcellines', 'École maternelle Collège international Marie de France', 'ETEQ College', 'Atmique', 'Association Marketing HEC Montréal', 'Garderie Qwaqwaq', 'CPE Hôpital Sainte Justine 2eme installation', 'United Talmud Torahs of Montreal Inc. (Snowdon School)', 'Jaren the Voiceover', 'Talmud Torah Elementary School', 'Nursery Chez Mouna', 'Ecole Azreli']",785.5714285714286,127
